{
  "schemaVersion": 1,
  "network": "localhost",
  "chainId": 1337,
  "protocolCommit": "801d039440c511b5730eb2413867c57cc59ba5b2",
  "accountCreationCodeHash": "0x0ceb0dedea4ef4116408608951cc94fac5363e0f61cf2fe4c9ec086da680c7b1",
  "deploymentBlock": 1,
  "dependencies": {
    "filecoinPay": "0xa111111111111111111111111111111111111111",
    "pdpVerifier": "0xb222222222222222222222222222222222222222",
    "fwssService": "0xc333333333333333333333333333333333333333",
    "fwssStateView": "0xd444444444444444444444444444444444444444",
    "token": "0xe555555555555555555555555555555555555555"
  },
  "contracts": {
    "BossFactory": {
      "address": "0x1111111111111111111111111111111111111111",
      "runtimeCodeHash": "0x1111111111111111111111111111111111111111111111111111111111111111",
      "deploymentTxHash": "0xa111111111111111111111111111111111111111111111111111111111111111",
      "deploymentBlock": 1
    },
    "BossServiceRegistry": {
      "address": "0x2222222222222222222222222222222222222222",
      "runtimeCodeHash": "0x2222222222222222222222222222222222222222222222222222222222222222",
      "deploymentTxHash": "0xa222222222222222222222222222222222222222222222222222222222222222",
      "deploymentBlock": 2
    },
    "BossAdapterRegistry": {
      "address": "0x3333333333333333333333333333333333333333",
      "runtimeCodeHash": "0x3333333333333333333333333333333333333333333333333333333333333333",
      "deploymentTxHash": "0xa333333333333333333333333333333333333333333333333333333333333333",
      "deploymentBlock": 3
    },
    "BossBundles": {
      "address": "0x4444444444444444444444444444444444444444",
      "runtimeCodeHash": "0x4444444444444444444444444444444444444444444444444444444444444444",
      "deploymentTxHash": "0xa444444444444444444444444444444444444444444444444444444444444444",
      "deploymentBlock": 4
    },
    "BossStateView": {
      "address": "0x5555555555555555555555555555555555555555",
      "runtimeCodeHash": "0x5555555555555555555555555555555555555555555555555555555555555555",
      "deploymentTxHash": "0xa555555555555555555555555555555555555555555555555555555555555555",
      "deploymentBlock": 5
    }
  }
}
